id_str	title_str	year_int	director_str	story_str	actors_list	genres_list	countries_list	rating_float	voters_int	gross_int
tt4361050	Ouija: Origin of Evil	2016	Mike Flanagan	In 1967 Los Angeles, a young widow named Alice Zander works out of her suburban home as a spiritual medium, accompanied by her daughters, 15-year-old Paulina "Lina" and 9-year old Doris. The family is still reeling over the recent death of Roger, Alice's husband and the kids' father. At Lina's suggestion, Alice incorporates a Ouija board into her readings. While trying out the board, she unknowingly contacts a spirit named Marcus that begins to possess Doris. Alice receives a notice that the bank intends to foreclose on their home. Doris contacts the board for help, believing she is communicating with her dead father. The spirit leads her to a secret compartment behind the basement wall containing a pouch of cash. When she gives the money to her mother, the family has an Ouija session, believing they can contact Roger. When the board answers a question only Roger would know the answer to, a thrilled Alice begins believing that they are in contact with her dead husband..	Elizabeth Reaser,Lulu Wilson,Annalise Basso	Drama,Horror,Mystery,Thriller	USA,China,Japan	6.1	47563	14065500
tt2361317	Live by Night	2016	Ben Affleck	Boston, 1926. The '20s are roaring. Liquor is flowing, bullets are flying, and one man sets out to make his mark on the world. Prohibition has given rise to an endless network of underground distilleries, speakeasies, gangsters, and corrupt cops. Joe Coughlin, the youngest son of a prominent Boston police captain, has long since turned his back on his strict and proper upbringing. Now having graduated from a childhood of petty theft to a career in the pay of the city's most fearsome mobsters, Joe enjoys the spoils, thrills, and notoriety of being an outlaw. But life on the dark side carries a heavy price. In a time when ruthless men of ambition, armed with cash, illegal booze, and guns, battle for control, no one-neither family nor friend, enemy nor lover-can be trusted. Beyond money and power, even the threat of prison, one fate seems most likely for men like Joe: an early death. But until that day, he and his friends are determined to live life to the hilt. Joe embarks on a dizzying...	Ben Affleck,Elle Fanning,Brendan Gleeson	Action,Crime,Drama,Thriller	USA	6.4	47468	33000
tt4468740	Paddington 2	2017	Paul King	Paddington is happily settled with the Brown family in Windsor Gardens, where he has become a popular member of the community, spreading joy and marmalade wherever he goes. While searching for the perfect present for his beloved Aunt Lucy's 100th birthday, Paddington spots a unique pop-up book in Mr. Gruber's antique shop, and embarks upon a series of odd jobs to buy it. But when the book is stolen, it's up to Paddington and the Browns to unmask the thief.	Ben Whishaw,Hugh Grant,Hugh Bonneville	Adventure,Comedy,Family,Fantasy	UK,France,USA	7.9	47232	11001961
tt2910904	Haute couture	2015	Jocelyn Moorhouse	Based on Rosalie Ham's best selling novel, The Dressmaker is the story of femme fatale Tilly Dunnage who returns to her small home town in the country to right the wrongs of the past. A stylish drama with comic undertones about love, revenge and haute couture.	Kate Winslet,Judy Davis,Liam Hemsworth	Comedy,Drama	Australia	7.1	47167	185165
tt6265828	A Ghost Story	2017	David Lowery	Resonating with vibrant memories and silent echoes of a shared life, the old house is somehow connected to "C", a sensitive composer who is hesitant of leaving it, while his loving wife "M", on the other hand, is keen on moving out, having an indecipherable but grim premonition of danger. Sadly, disaster soon strikes, and C's untethered spectre which detaches from the lifeless body, rises from the mortician's table, and in a swift decision, decides to linger in this dimension to faithfully follow the grieving M back to the old house. As silent as a shadow and as invisible as the air, C's unappeasable phantom observes M's denial and depression gradually turn to acceptance and even hope, as time unravels, moving forward through the decades. In this earth, man struggles to leave his legacy behind. Is this the way to immortality?	Casey Affleck,Rooney Mara,McColm Cephas Jr.	Drama,Fantasy,Romance	USA	6.8	46798	104030
tt2547584	The Light Between Oceans	2016	Derek Cianfrance	A war weary man takes a job as a lighthouse keeper on an island for the solitude. He meets a beautiful young woman and they eventually marry. One day they see a small dingy with an infant and man inside floating in the ocean. They rush to rescue them only to find the man is dead. They struggle over the decision to report it and whether to keep the baby. It's only years later that they discover that the child still has a mother looking for her.	Michael Fassbender,Alicia Vikander,Rachel Weisz	Drama,Romance	UK,New Zealand,USA,India	7.2	46685	4765
tt1374989	Pride and Prejudice and Zombies	2016	Burr Steers	The five highly trained Bennett sisters in Georgian England must try to protect themselves from the growing zombie threat, find suitable husbands for themselves, battle marriage proposals and unlikely suitors, and save the country before it's too late.	Lily James,Sam Riley,Jack Huston	Action,Comedy,Horror,Romance	USA,UK	5.8	46484	5324240
tt3553442	Whiskey Tango Foxtrot	2016	Glenn Ficarra	2003. After careful consideration, Kim Baker, a news copywriter, decides to leave the relative comfort of a New York desk job and serious boyfriend Chris to accept the assignment to work for three months as on-camera reporter in war torn Afghanistan, as her news agency is looking for anyone within their ranks to fill immediately the empty voids overseas. Her only experience of being in such an environment is going through hostile zone training a few years earlier. Immediately upon her arrival in Afghanistan, she realizes that she is ill-prepared emotionally for this assignment, not only enduring the dangers of the war itself, but also the conditions of everyday life, including largely been seen by men as only a "piece of ass" and a distraction despite her being considered average looking back home and not being overtly sexual, and being an individual with a small bladder who is nonetheless told to stay hydrated at all times. She is largely assisted in navigating this new life by Tanya...	Tina Fey,Margot Robbie,Martin Freeman	Biography,Comedy,Drama,War	USA	6.6	46446	7443007
tt3829920	Only the Brave	2017	Joseph Kosinski	In 2007 Prescott, Arizona, Eric Marsh of the Prescott Fire Department is frustrated fighting forest fires when the Type 1 or "Hotshot" front line forest fire fighting crews from afar overrule his operational suggestions to his area's sorrow. To change that, Marsh gets approval from the Mayor to attempt to organize an unprecedented certified municipal-based Hotshot crew for Prescott. To that end, Marsh needs new recruits, which includes the young wastrel, Brendan McDonough, to undergo the rigorous training and qualification testing for the most dangerous of fire fighting duty. Along the way, the new team meets the challenge and the hailed Granite Mountain Hotshots are born. In doing so, all the men, especially McDonough, are changed as new experience and maturity is achieved in fire-forged camaraderie. All this is put to the test in 2013 with the notorious Yarnell Hill Fire that will demand efforts and sacrifices no one can ignore.	Josh Brolin,Miles Teller,Jeff Bridges	Action,Biography,Drama	USA	7.7	46162	6002665
tt4765284	Pitch Perfect 3	2017	Trish Sie	After the highs of winning the World Championships, the Bellas find themselves split apart and discovering there aren't job prospects for making music with your mouth. But when they get the chance to reunite for an overseas USO tour, this group of awesome nerds will come together to make some music, and some questionable decisions, one last time.	Anna Kendrick,Rebel Wilson,Brittany Snow	Comedy,Music	USA	5.8	45773	19928525
tt1124037	Free State of Jones	2016	Gary Ross	Set during the Civil War, Free State of Jones tells the story of defiant Southern farmer, Newt Knight, and his extraordinary armed rebellion against the Confederacy. Banding together with other small farmers and local slaves, Knight launched an uprising that led Jones County, Mississippi to secede from the Confederacy, creating a Free State of Jones. Knight continued his struggle into Reconstruction, distinguishing him as a compelling, if controversial, figure of defiance long beyond the War.	Matthew McConaughey,Gugu Mbatha-Raw,Mahershala Ali	Action,Biography,Drama,History,War	USA	6.9	45459	7772
tt2461150	Masterminds	2016	Jared Hess	David Ghantt discovers the true meaning of adventure far beyond his wildest dreams. He is an uncomplicated man stuck in a monotonous life. Day in and day out he drives an armored vehicle, transporting millions of other people's money with no escape in sight. The only glimmer of excitement is his flirtatious work crush Kelly Campbell who soon lures him into the scheme of a lifetime. Along with a group of half-brained criminals led by Steve Chambers and an absurdly faulted heist plan, David manages the impossible and makes off with $17 million in cash...only problem is he foolishly hands the money over to this wild group of double crossers and has been set up to take the fall. With the bandits blowing the millions on lavish and ridiculous luxuries, they leave behind a glaring trail of evidence. Now on the lam and in over his head, David must dodge the authorities, evade a hilarious hit man, Mike McKinney, and try to turn the tables on the ones he trusted most.	Zach Galifianakis,Kristen Wiig,Owen Wilson	Action,Biography,Comedy,Crime	USA	5.8	45428	6541205
tt4136084	Florence Foster Jenkins	2016	Stephen Frears	Florence Foster Jenkins, an heiress from NYC, always wanted to be a concert pianist and play Carnegie Hall. An injury in her youth deterred that dream, so she sets out to sing her way to Carnegie Hall, knowing the only way to get there would be, "Practice, practice, practice". Her husband supports her venture, and Florence Foster Jenkins' performance at Carnegie Hall becomes a truly historic event.	Meryl Streep,Hugh Grant,Simon Helberg	Biography,Comedy,Drama,Music	UK,France	6.8	45253	6601313
tt2967224	Hot Pursuit	2015	Anne Fletcher	Rose Cooper is an uptight and by-the-book cop whose name has become synonymous with screw-ups. She's given a chance to redeem herself one day when she is assigned to protect a federal witness, Daniella Riva, the vivacious and outgoing widow of a drug boss. As the two polar opposites race through Texas, they find themselves pursued by everyone from crooked cops to murderous gunmen. However, their greatest obstacle to making this out alive may be themselves as they learn that Cooper has now been considered a fugitive fleeing with Daniella.	Reese Witherspoon,Sofía Vergara,Matthew Del Negro	Action,Comedy,Crime	USA	5.1	44938	13942258
tt7014006	Eighth Grade	2018	Bo Burnham	In his feature film directorial debut, comedian Bo Burnham deftly encapsulates the awkwardness, angst, self-loathing and reinvention that a teenage girl goes through on the cusp of high school. Given that the 27-year-old stand-up comic achieved fame as a teenager himself through YouTube by riffing on his insecurities, he is uniquely capable as the film's writer and director to tell the story of Kayla, an anxious girl navigating the final days of her eighth grade year, despite creating a protagonist w female instead of male. Like Burnham did more than a decade ago, 13-year-old Kayla turns to YouTube to express herself, where she makes advice blogs in which she pretends to have it all together. In reality, Kayla is sullen and silent around her single father and her peers at school, carrying out most of her interactions with her classmates on Instagram and Twitter. Her YouTube videos are a clever narrative tool that provide insight into her inner hopes and dreams, much like an ...	Elsie Fisher,Josh Hamilton,Emily Robinson	Comedy,Drama	USA	7.5	44858	263797
tt4995790	The Square	2017	Ruben Östlund	Christian is the respected curator of a contemporary art museum, a divorced but devoted father of two who drives an electric car and supports good causes. His next show is "The Square", an installation which invites passersby to altruism, reminding them of their role as responsible fellow human beings. But sometimes, it is difficult to live up to your own ideals: Christian's foolish response to the theft of his phone drags him into shameful situations. Meanwhile, the museum's PR agency has created an unexpected campaign for "The Square". The response is overblown and sends Christian, as well as the museum, into an existential crisis.	Claes Bang,Elisabeth Moss,Dominic West	Comedy,Drama	Sweden,Germany,France,Denmark	7.2	44711	74233
tt4477536	Fifty Shades Freed	2018	James Foley	Believing they have left behind shadowy figures from their past, newlyweds Christian and Ana fully embrace an inextricable connection and shared life of luxury. But just as she steps into her role as Mrs. Grey and he relaxes into an unfamiliar stability, new threats could jeopardize their happy ending before it even begins.	Dakota Johnson,Jamie Dornan,Eric Johnson	Drama,Romance,Thriller	USA	4.5	44581	38560195
tt5168192	I, Daniel Blake	2016	Ken Loach	A 59 year old carpenter recovering from a heart attack befriends a single mother and her two kids as they navigate their way through the impersonal, Kafkaesque benefits system. With equal amounts of humor, warmth and despair, the journey is heartfelt and emotional until the end.	Dave Johns,Hayley Squires,Sharon Percy	Drama	UK,France,Belgium	7.9	44557	18682
tt4532826	Robin Hood	2018	Otto Bathurst	A war-hardened crusader Robin of Loxley (Taron Egerton) and his Moorish commander (Jamie Foxx) mount an audacious revolt against the corrupt English crown.	Taron Egerton,Jamie Foxx,Ben Mendelsohn	Action,Adventure,Thriller	USA	5.3	44457	9195670
tt0787524	The Man Who Knew Infinity	2015	Matt Brown	In the 1910s, Srinivasa Ramanujan is a man of boundless intelligence that even the abject poverty of his home in Madras, India, cannot crush. Eventually, his stellar intelligence in mathematics and his boundless confidence in both attract the attention of the noted British mathematics professor, G.H. Hardy, who invites him to further develop his computations at Trinity College at Cambridge. Forced to leave his young wife, Janaki, behind, Ramanujan finds himself in a land where both his largely intuitive mathematical theories and his cultural values run headlong into both the stringent academic requirements of his school and mentor and the prejudiced realities of a Britain heading into World War One. Facing this with a family back home determined to keep him from his wife and his own declining health, Ramanujan joins with Hardy in a mutual struggle that would define Ramanujan as one of India's greatest modern scholars who broke more than one barrier in his worlds.	Dev Patel,Jeremy Irons,Malcolm Sinclair	Biography,Drama	UK,USA	7.2	43949	80325
tt2279373	The SpongeBob Movie: Sponge Out of Water	2015	Paul Tibbitt	During a fight between the Krusty Krab and Plankton, the secret formula disappears and all of Bikini Bottom goes into a terrible apocalypse. The Bikini Bottomites go crazy and they all believe that Spongebob and Plankton stole the secret formula. The two new teammates create a time machine to get the secret formula before it disappears and also go to some weird places along the way including a time paralex where they meet a time wizard named Bubbles who is a dolphin. The two later get to the time when the formula disappeared and take it back to the present day time. They then realized that it's a fake formula Plankton made when he was taking the real one and the Bikini Bottomites try to destroy Spongebob (Plankton runs away) Spongebob smells Krabby patties and so does everyone else so the Bikini Bottomites follow it (instead of destroying Spongebob) and they arrive at the bank of the surface. Everyone except Spongebob, Patrick, Mr. Krabs, Squidward, Sandy, and a stowaway Plankton go ...	Tom Kenny,Antonio Banderas,Bill Fagerbakke	Animation,Adventure,Comedy,Family,Fantasy	USA,South Korea,Australia	6.0	43910	55365012
tt4622512	Battle of the Sexes	2017	Jonathan Dayton	In the wake of the sexual revolution and the rise of the women's movement, the 1973 tennis match between women's world champion Billie Jean King (Emma Stone) and ex-men's-champ and serial hustler Bobby Riggs (Steve Carell) was billed as the BATTLE OF THE SEXES and became one of the most watched televised sports events of all time, reaching 90 million viewers around the world. As the rivalry between King and Riggs kicked into high gear, off-court each was fighting more personal and complex battles. The fiercely private King was not only championing for equality, but also struggling to come to terms with her own sexuality, as her friendship with Marilyn Barnett (Andrea Riseborough) developed. And Riggs, one of the first self-made media-age celebrities, wrestled with his gambling demons, at the expense of his family and wife Priscilla (Elisabeth Shue). Together, Billie and Bobby served up a cultural spectacle that resonated far beyond the tennis court, sparking discussions in bedrooms ...	Emma Stone,Steve Carell,Andrea Riseborough	Biography,Comedy,Drama,Sport	UK,USA	6.7	43707	515450
tt5220122	Hotel Transylvania 3: Summer Vacation	2018	Genndy Tartakovsky	Mavis surprises Dracula with a family voyage on a luxury Monster Cruise Ship so he can take a vacation from providing everyone else's vacation at the hotel. The rest of Drac's Pack cannot resist going along. But once they leave port, romance arises when Dracula meets the mysterious ship Captain, Ericka. Now it's Mavis' turn to play the overprotective parent, keeping her dad and Ericka apart. Little do they know that his "too good to be true" love interest is actually a descendant of Abraham Van Helsing, ancient nemesis to Dracula and all other monsters.	Adam Sandler,Andy Samberg,Selena Gomez	Animation,Adventure,Comedy,Family,Fantasy	USA,South Korea	6.3	43491	44076225
tt5592248	The Beguiled	2017	Sofia Coppola	Three years into the American Civil War, in 1864, the dilapidated mansion of Miss Martha Farnsworth's Seminary for Young Ladies is still running, occupied by the matriarch, a teacher and five students in Spanish moss-draped Virginia. However, when a young student stumbles upon Corporal John McBurney, a wounded Union deserter on the verge of death, the already frail balance of things will be disrupted, as the hesitant headmistress decides to take him in to heal from his injury. Little by little, as the unwelcome guest arouses an uneasy sexual excitation among the women of the secluded boarding school, it is not before long that they will find themselves competing for the alluring man's favour. Undoubtedly, this handsome devil is a manipulator, nevertheless, will the ladies stay forever beguiled by his charm?	Nicole Kidman,Kirsten Dunst,Elle Fanning	Drama,Thriller	USA	6.3	43457	229292
tt4244998	Alpha	2018	Albert Hughes	An epic adventure set in the last Ice Age, Alpha is a fascinating, visually stunning story that shines a light on the origins of man's best friend. While on his first hunt with his tribe's most elite group, a young man is injured and must learn to survive alone in the wilderness. After the young man reluctantly tames a lone wolf abandoned by its pack, the pair learn to rely on each other and become unlikely allies, enduring countless dangers and overwhelming odds in order to find their way home before winter arrives.	Kodi Smit-McPhee,Jóhannes Haukur Jóhannesson,Marcin Kowalczyk	Adventure,Drama,Family	USA	6.7	43150	10352512
tt5726086	Insidious: la dernière clé	2018	Adam Robitel	The parapsychologist Dr. Elise Rainier has nightmares with her childhood in New Mexico, where she lived with her brother Christian, her supportive mother Audrey and her father Gerald, who frequently beats her when she claims that she sees ghosts everywhere in the house. When the client Ted Garza calls Elise to ask for help since he is haunted since he moved to a house in New Mexico, Elise refuses the request since the address is the same house where she spent her childhood. However she changes her mind and accepts the job, and travels with her assistants Specs and Tucker to New Mexico where they will discover an evil entity in the house.	Lin Shaye,Leigh Whannell,Angus Sampson	Horror,Mystery,Thriller	Canada,USA	5.7	43032	29581355
tt6133466	The First Purge	2018	Gerard McMurray	This horror/action-adventure film from director Gerard McMurray serves as a prequel that recounts events that led up to the first Purge event. To push the crime rate below one percent for the rest of the year, the New Founding Fathers of America (NFFA) test a sociological theory that vents aggression for one night in one isolated community.	Y'lan Noel,Lex Scott Davis,Joivan Wade	Action,Horror,Sci-Fi,Thriller	USA	5.1	42783	17374280
tt2752772	Sinister 2	2015	Ciarán Foy	Following the events from the first film, a different family; a mother and her 2 sons move into a rural house that's marked for death. When the deputy from the first film learns that this family is next in line to fall to the demon Bhughul, he races before time to stop it and save them from the same fate.	James Ransone,Shannyn Sossamon,Robert Daniel Sloan	Horror,Mystery,Thriller	USA,UK	5.3	42266	10542116
tt5610554	Tully	2018	Jason Reitman	The film is about Marlo, a mother of three, including a newborn. Marlo's brother gives her a night nanny as a gift. Hesitant with the extravagance at first, Marlo comes to form a unique bond with the thoughtful, surprising, and sometimes challenging young nanny named Tully.	Charlize Theron,Mackenzie Davis,Ron Livingston	Comedy,Drama,Mystery	USA,Canada	7.0	42016	3282610
tt5186714	Le client	2016	Asghar Farhadi	Forced to leave their collapsing house, Ranaa and Emad, an Iranian couple who happen to be performers rehearsing for Arthur Miller's "Death of a Salesman" rent a new apartment from one of their fellow performers. Unaware of the fact that the previous tenant had been a woman of ill repute having many clients, they settle down. By a nasty turn of events one of the clients pays a visit to the apartment one night while Ranaa is alone at home taking a bath and the aftermath turns the peaceful life of the couple upside down.	Shahab Hosseini,Taraneh Alidoosti,Mina Sadati	Drama,Thriller	Iran,France	7.8	41972	71078
tt4139124	Keanu	2016	Peter Atencio	Rell's life is changed forever when a cute kitten comes to his door, and he names it Keanu. Unfortunately, one weekend later, Keanu is abducted by persons unknown. Now Rell and his cousin, Clarence, are men on a mission to find Keanu against the odds. Unfortunately, those odds prove to be perilously high as they find Keanu in the care of the ruthless gangster, Cheddar, and he will only part with him for a price. Now for that cute kitten, these two middle class bumblers find themselves neck deep in a dangerous alien world of drugs and gang violence with only their desperate audacity, creativity and sheer dumb luck giving them a chance to survive.	Keegan-Michael Key,Jordan Peele,Tiffany Haddish	Action,Comedy,Crime	USA	6.3	41899	9453224
tt3922818	The Space Between Us	2017	Peter Chelsom	In this interplanetary adventure, a space shuttle embarks on the first mission to colonize Mars, only to discover after takeoff that one of the astronauts is pregnant. Shortly after landing, she dies from complications while giving birth to the first human born on the red planet - never revealing who the father is. Thus begins the extraordinary life of Gardner Elliot - an inquisitive, highly intelligent boy who reaches the age of 16 having only met 14 people in his very unconventional upbringing. While searching for clues about his father, and the home planet he's never known, Gardner begins an online friendship with a street smart girl in Colorado named Tulsa. When he finally gets a chance to go to Earth, he's eager to experience all of the wonders he could only read about on Mars - from the most simple to the extraordinary. But once his explorations begin, scientists discover that Gardner's organs can't withstand Earth's atmosphere. Eager to find his father, Gardner escapes the team...	Gary Oldman,Asa Butterfield,Carla Gugino	Adventure,Drama,Romance,Sci-Fi	USA	6.4	41803	3775596
tt2091935	Mr. Right	2015	Paco Cabezas	After going through a painful break-up, a woman meets a man who appears to be perfect for her. However, as their relationship develops, she learns that he is a former hit-man. Their new, but genuine, relationship is tested even further as they try to save each other, from his dark past which has come back to haunt him.	Anna Kendrick,Sam Rockwell,Tim Roth	Action,Comedy,Romance	USA	6.3	41762	25369
