id_str	title_str	year_int	director_str	story_str	actors_list	genres_list	countries_list	rating_float	voters_int	gross_int
tt1502407	Halloween	2018	David Gordon Green	In October 2018, forty years after the massacre in Haddonfield, true-crime pod-casters Aaron Korey and Dana Haines travel to Warren County Smith's Grove Sanitarium to visit Michael Myers. They briefly interview Michael's psychiatrist Dr. Ranbir Sartain, a former student of Dr. Samuel Loomis, before meeting with Michael in hopes of gaining some insight into his past actions before his transfer to a new facility. Aaron brandishes Michael's mask at him, to no effect. In Haddonfield, Illinois, Laurie Strode is living an isolated life, having been divorced twice, developed a strained relationship with her family and turned to alcohol. Laurie has prepared for Michael's potential return through combat training. The following night, Michael's transport crashes. Michael kills a father and his son who stumble upon the crashed bus on the road, and steals their car. The following day, on Halloween, Michael resumes his killing spree, killing several people at a gas station, including a clerk, a ...	Jamie Lee Curtis,Judy Greer,Andi Matichak	Horror,Thriller	USA	6.6	91840	76221545
tt4062536	Green Room	2015	Jeremy Saulnier	A band straying into a secluded part of the Pacific Northwest stumbles onto a horrific act of violence. Because they are the only witnesses, they become the targets of a terrifying gang of skinheads who want to make sure all the evidence is eliminated.	Anton Yelchin,Imogen Poots,Alia Shawkat	Horror,Music,Thriller	USA	7.0	91642	87984
tt5715874	The Killing of a Sacred Deer	2017	Yorgos Lanthimos	After the untimely death of 16-year-old Martin's father on the operating table, little by little, a deep and empathetic bond begins to form between him and the respected cardiothoracic surgeon, Dr Steven Murphy. At first, expensive gifts and then an invitation for dinner will soon earn the orphaned teenager the approval of Dr Steven's perfect family, even though right from the start, a vague, yet unnerving feeling overshadows Martin's honest intent. And then, unexpectedly, the idyllic family is smitten by a fierce and pitiless punishment, while at the same time, everything will start falling apart as the innocents have to suffer. In the end, as the sins of one burden the entire family, only an unimaginable and unendurable decision that demands a pure sacrifice can purge the soul. But to find catharsis, one must first admit the sin.	Barry G. Bernson,Herb Caillouet,Bill Camp	Drama,Mystery,Thriller	Ireland,UK	7.0	91533	115120
tt2304933	The 5th Wave	2016	J Blakeson	Four waves of increasingly deadly attacks have left most of Earth in ruin. Against a backdrop of fear and distrust, Cassie is on the run, desperately trying to save her younger brother. As she prepares for the inevitable and lethal fifth wave, Cassie teams up with a young man who may become her final hope - if she can only trust him.	Chloë Grace Moretz,Matthew Zuk,Gabriela Lopez	Action,Adventure,Drama,Fantasy,Sci-Fi,Thriller	USA,UK	5.2	91262	10326356
tt2557478	Pacific Rim: Uprising	2018	Steven S. DeKnight	It is 2035, ten years after the Battle of the Breach, in which the inter-dimensional portal created by the Precursors (through which they sent marauding Kaiju) was closed. Former Jaeger pilot Jake Pentecost - son of Battle of the Breach hero Stacker Pentecost - makes a living by stealing and selling Jaeger parts on the black market in the Los Angeles area. After he tracks part of a disabled Jaeger's power core to the secret workshop of fifteen year-old Jaeger enthusiast Amara Namani, both are arrested by the Pan-Pacific Defense Corps (PPDC) after an altercation between Amara's small, single-pilot Jaeger Scrapper and the Police Jaeger November Ajax. A holographic transmission of Jake's adoptive sister and PPDC Secretary General Mako Mori persuades him to return to PPDC as an instructor, with Amara as his recruit..	John Boyega,Scott Eastwood,Cailee Spaeny	Action,Adventure,Sci-Fi	UK,China,Japan,USA	5.6	90773	28116535
tt4501244	Why Him?	2016	John Hamburg	Over the holidays, Ned, an overprotective but loving dad and his family visit his daughter at Stanford, where he meets his biggest nightmare: her well-meaning but socially awkward Silicon Valley millionaire boyfriend, Laird. The rivalry develops,and Ned's panic level goes through the roof when he finds himself lost in this glamorous high-tech world and learns that Laird is about to pop the question.	Zoey Deutch,James Franco,Tangie Ambrose	Comedy	USA,Cambodia	6.2	90280	11002986
tt5308322	Happy Death Day	2017	Christopher Landon	A teenage girl, trying to enjoy her birthday, soon realizes that this is her final one. That is, if she can figure out who her killer is. She must relive that day, over and over again, dying in a different way each time. Can she solve her own murder?	Jessica Rothe,Israel Broussard,Ruby Modine	Horror,Mystery,Thriller	USA	6.5	89571	26039025
tt1878870	The Edge of Seventeen	2016	Kelly Fremon Craig	Everyone knows that growing up is hard, and life is no easier for high school junior Nadine (Hailee Steinfeld), who is already at peak awkwardness when her all-star older brother Darian (Blake Jenner) starts dating her best friend Krista (Haley Lu Richardson). All at once, Nadine feels more alone than ever, until the unexpected friendship of a thoughtful boy (Hayden Szeto) gives her a glimmer of hope that things just might not be so terrible after all.	Hailee Steinfeld,Haley Lu Richardson,Blake Jenner	Comedy,Drama	USA,China	7.3	88685	4754215
tt4698684	Hunt for the Wilderpeople	2016	Taika Waititi	Bella and Hector, two reclusive country folk, become foster parents to Ricky, a problem child from the city. After some adjustment, things go reasonably well. However, the death of Bella means Hector now has to look after Ricky, and they didn't get along too well. Moreover, her death causes Child Services to decide to send Ricky back to the orphanage. Ricky refuses to go back and runs away, ultimately sparking a national manhunt for him and Hector.	Sam Neill,Julian Dennison,Rima Te Wiata	Adventure,Comedy,Drama	New Zealand	7.9	88315	77298
tt2381991	The Huntsman: Winter's War	2016	Cedric Nicolas-Troyan	Evil sorceress Queen Ravenna's powers allow her to know that her younger sister Freya, whose powers have not yet emerged, is not only involved in an illicit affair with an already elsewhere engaged nobleman Andrew, but is also pregnant with his child. Sometime after Freya gives birth to a baby girl, Freya discovers that Andrew not only reneged on his promise of elopement with her but also murdered their child. In a grief-fueled rage, her broken heart freezes over and she kills him with her sudden emergence of powers - the elemental control of ice..	Chris Hemsworth,Jessica Chastain,Charlize Theron	Action,Adventure,Drama,Fantasy	USA,China	6.1	88289	19445035
tt3622592	Paper Towns	2015	Jake Schreier	Adapted from the bestselling novel by author John Green, PAPER TOWNS is a coming-of-age story centering on Quentin and his enigmatic neighbor Margo, who loved mysteries so much she became one. After taking him on an all-night adventure through their hometown, Margo suddenly disappears - leaving behind cryptic clues for Quentin to decipher. The search leads Quentin and his quick-witted friends on an exhilarating adventure that is equal parts hilarious and moving. Ultimately, to track down Margo, Quentin must find a deeper understanding of true friendship - and true love.	Nat Wolff,Cara Delevingne,Austin Abrams	Comedy,Drama,Mystery,Romance	USA	6.3	88190	12650140
tt2854926	Tag	2018	Jeff Tomsic	Childhood friends Jerry (Jeremy Renner), Callahan (Jon Hamm), Randy (Jake Johnson), Sable (Hannibal Buress) and Hoagie (Ed Helms) have been competing in the same game of tag for 30 years. When Jerry gets married, he attempts to retire from the intense annual game without ever being "it," causing the other four to band together and go to extreme lengths to finally tag him. Directed by Jeff Tomsic. Inspired by the Wall Street Journal article "It Takes Planning, Caution to Avoid Being It."	Jeremy Renner,Ed Helms,Jake Johnson	Comedy	USA	6.5	88138	14947396
tt1524930	Vacation	2015	John Francis Daley	Hoping to bring his family closer together and to recreate his childhood vacation for his own kids, an adult Rusty Griswold takes his wife and two sons on a cross-country road trip to Walley World. Needless to say, things don't go quite as planned.	Ed Helms,Christina Applegate,Skyler Gisondo	Adventure,Comedy	USA	6.1	88106	14681108
tt1524930	Vacation	2015	John Francis Daley	Hoping to bring his family closer together and to recreate his childhood vacation for his own kids, an adult Rusty Griswold takes his wife and two sons on a cross-country road trip to Walley World. Needless to say, things don't go quite as planned.	Ed Helms,Christina Applegate,Skyler Gisondo	Adventure,Comedy	USA	6.1	88106	14681108
tt2671706	Fences	2016	Denzel Washington	Troy Maxson makes his living as a sanitation worker in 1950s Pittsburgh. Maxson once dreamed of becoming a professional baseball player, but was deemed too old when the major leagues began admitting black athletes. Bitter over his missed opportunity, Troy creates further tension in his family when he squashes his son's chance to meet a college football recruiter.	Denzel Washington,Viola Davis,Stephen McKinley Henderson	Drama	USA,Canada	7.2	87490	129462
tt2241351	Money Monster	2016	Jodie Foster	In the real-time, high stakes thriller Money Monster, George Clooney and Julia Roberts star as financial TV host Lee Gates and his producer Patty, who are put in an extreme situation when an irate investor who has lost everything (Jack O'Connell) forcefully takes over their studio. During a tense standoff broadcast to millions on live TV, Lee and Patty must work furiously against the clock to unravel the mystery behind a conspiracy at the heart of today's fast-paced, high-tech global markets.	George Clooney,Julia Roberts,Jack O'Connell	Crime,Drama,Thriller	USA	6.5	87113	14788157
tt1618442	The Last Witch Hunter	2015	Breck Eisner	The modern world holds many secrets, but the most astounding secret of all is that witches still live amongst us; vicious supernatural creatures intent on unleashing the Black Death upon the world. Armies of witch hunters battled the unnatural enemy across the globe for centuries, including Kaulder, a valiant warrior who managed to slay the all-powerful Queen Witch, decimating her followers in the process. In the moments right before her death, the Queen curses Kaulder with her own immortality, forever separating him from his beloved wife and daughter in the afterlife. Today Kaulder is the only one of his kind remaining, and has spent centuries hunting down rogue witches, all the while yearning for his long-lost loved ones. However, unbeknownst to Kaulder, the Queen Witch is resurrected and seeks revenge on her killer causing an epic battle that will determine the survival of the human race.	Vin Diesel,Rose Leslie,Elijah Wood	Action,Adventure,Fantasy	USA,China,Canada	6.0	86676	10812861
tt2224026	Home	2015	Tim Johnson	When Oh, a loveable misfit from another planet, lands on Earth and finds himself on the run from his own people, he forms an unlikely friendship with an adventurous girl named Tip who is on a quest of her own. Through a series of comic adventures with Tip, Oh comes to understand that being different and making mistakes is all part of being human. And while he changes her planet and she changes his world, they discover the true meaning of the word HOME.	Jim Parsons,Rihanna,Steve Martin	Animation,Adventure,Comedy,Family,Fantasy,Sci-Fi	USA	6.6	86184	52107731
tt7040874	A Simple Favor	2018	Paul Feig	Stephanie Smothers (Anna Kendrick) is a widowed single mother who runs a blog with crafts and recipes. Emily (Blake Lively) is a busy working mother, a PR director for a fashion company, whose son Nicky attends the same elementary school as Stephanie's son, Miles. Emily and Stephanie become fast friends, arranging play dates for the boys. They trade confessions, and Stephanie admits that as a teenager, she had sex with her half-brother, Chris. Emily expresses her frustration at the lack of success of her husband, English professor Sean Townsend, and their poor financial situation. Emily has a work crisis and asks Stephanie to babysit Nicky, as Sean is in London. After two days of Emily not responding to calls, Stephanie calls Emily's employer, Dennis Nylon, and he tells her she is in Miami. Stephanie calls Sean, who calls the police. Emily had told both Stephanie and Sean that she hates having her picture taken, leading Stephanie to sneak into Emily's work and find a photo, which she ...	Anna Kendrick,Blake Lively,Henry Golding	Comedy,Crime,Drama,Mystery,Thriller	Canada,USA	6.9	85935	16050000
tt0490215	Silence	2016	Martin Scorsese	The story of two Catholic missionaries (Andrew Garfield and Adam Driver) who face the ultimate test of faith when they travel to Japan in search of their missing mentor (Liam Neeson) - at a time when Catholicism was outlawed and their presence forbidden.	Andrew Garfield,Adam Driver,Liam Neeson	Adventure,Drama,History	USA,UK,Taiwan,Japan,Mexico,Italy	7.2	85892	130880
tt1590193	The Commuter	2018	Jaume Collet-Serra	Now a hard-working life insurance salesman and a caring family man, the former police officer, Michael MacCauley, has taken the commuter rail to New York for the past ten years. But, unexpectedly, things will take a turn for the worse, when on one of his daily journeys, the cryptic passenger, Joanna, makes Michael a generous and tempting offer to locate a single commuter or face grave consequences. Is this a sick joke, or is this indeed a serious situation? As Michael races against the clock to solve this wicked conundrum, everyone aboard is a suspect, in a deal where there's definitely more than meets the eye. Can he decide in time who's the one?	Liam Neeson,Vera Farmiga,Patrick Wilson	Action,Mystery,Thriller	France,USA	6.3	84495	13701452
tt4481414	Gifted	2017	Marc Webb	Frank Adler (Chris Evans) is a single man raising a child prodigy - his spirited young niece Mary (Mckenna Grace) in a coastal town in Florida. Frank's plans for a normal school life for Mary are foiled when the seven-year-old's mathematical abilities come to the attention of Frank's formidable mother Evelyn (Lindsay Duncan) whose plans for her granddaughter threaten to separate Frank and Mary. Octavia Spencer plays Roberta, Frank and Mary's landlady and best friend. Jenny Slate is Mary's teacher, Bonnie, a young woman whose concern for her student develops into a connection with her uncle as well.	Chris Evans,Mckenna Grace,Lindsay Duncan	Drama	USA	7.6	83758	446380
tt3195644	Insidious: Chapitre 3	2015	Leigh Whannell	After trying to connect with her dead mother, teenager Quinn Brenner, asks psychic Elise Rainier to help her, she refuses due to negotiate events in her childhood. Quinn starts noticing paranormal events happen in her house. After a vicious attack from a demon her father goes back and begs Elise Rainier to use her abilities to contact the other side in hope to stop these attacks by this furious demon content for a body.	Dermot Mulroney,Stefanie Scott,Angus Sampson	Horror,Mystery,Thriller	Canada,UK,USA	6.1	83718	22692741
tt5758778	Skyscraper	2018	Rawson Marshall Thurber	FBI Hostage Rescue Team leader and U.S. war veteran Will Sawyer now assesses security for skyscrapers. On assignment in Hong Kong he finds the tallest, safest building in the world suddenly ablaze and he's been framed for it. A wanted man on the run, Will must find those responsible, clear his name and somehow rescue his family who are trapped inside the building - above the fire line.	Dwayne Johnson,Neve Campbell,Chin Han	Action,Adventure,Thriller	Hong Kong,USA	5.8	83620	24905015
tt5164432	Love, Simon	2018	Greg Berlanti	A young coming-of-age tale about a teenage boy, Simon Spier, goes through a different kind of Romeo and Juliet story. Simon has a love connection with a boy, Blue, by email, but the only problem is that Simon has no idea who he's talking to. Simon must discover who that boy is--who Blue is. Along the way, he tries to find himself as well.	Nick Robinson,Jennifer Garner,Josh Duhamel	Comedy,Drama,Romance	USA	7.6	83081	11756244
tt3381008	The Brothers Grimsby	2016	Louis Leterrier	MI6's top assassin (Mark Strong) has a brother. Unfortunately for him, he's a football hooligan (Sacha Baron Cohen) from the town of Grimsby. Nobby has everything a man from the poor English fishing town of Grimsby could want - 9 children and the most attractive girlfriend in northern England (Rebel Wilson). There's only one thing missing in his life: his little brother, Sebastian. After they were adopted by different families as children, Nobby spent 28 years searching for him. Upon hearing of his location, Nobby sets off to reunite with his brother, unaware that not only is his brother an MI6 agent, but he's just uncovered a plot that puts the world in danger. On the run and wrongfully accused, Sebastian realizes that if he is going to save the world, he will need the help of its biggest idiot.	Sacha Baron Cohen,Mark Strong,Rebel Wilson	Action,Adventure,Comedy,Crime,Thriller	UK,USA	6.2	82679	3258327
tt4465564	Fifty Shades Darker	2017	James Foley	Christian and Ana decide to rekindle their relationship, except this time there are no more rules or punishments. As they begin to get used to their newfound relationship, Christian's past begins to haunt Ana as Christian struggles with his innermost thoughts.	Dakota Johnson,Jamie Dornan,Eric Johnson	Drama,Romance	USA,China,Japan	4.6	82329	46607250
tt1615160	The Foreigner	2017	Martin Campbell	The story of humble London businessman Quan (Chan), whose long-buried past erupts in a revenge-fueled vendetta when the only person left for him to love - his teenage daughter - is taken from him in a senseless act of politically-motivated terrorism. In his relentless search for the identity of the terrorists, Quan is forced into a cat- and-mouse conflict with a Irish government official (Brosnan), whose own past may hold clues to the identities of the elusive killers.	Katie Leung,Jackie Chan,Rufus Jones	Action,Thriller	UK,China,USA	7.0	82283	13113024
tt2140379	Self/less	2015	Tarsem Singh	An extremely wealthy man, dying from cancer, undergoes a radical medical procedure that transfers his consciousness into the body of a healthy young man. But all is not as it seems when he starts to uncover the mystery of the body's origin and the organization that will kill to protect its cause.	Ryan Reynolds,Natalie Martinez,Matthew Goode	Action,Mystery,Sci-Fi,Thriller	USA	6.5	81085	5379000
tt2679042	Hitman: Agent 47	2015	Aleksander Bach	HITMAN: AGENT 47 centers on an elite assassin who was genetically engineered from conception to be the perfect killing machine, and is known only by the last two digits on the barcode tattooed on the back of his neck. He is the culmination of decades of research and forty-six earlier Agent clones -- endowing him with unprecedented strength, speed, stamina and intelligence. His latest target is a mega-corporation that plans to unlock the secret of Agent 47's past to create an army of killers whose powers surpass even his own. Teaming up with a young woman who may hold the secret to overcoming their powerful and clandestine enemies, 47 confronts stunning revelations about his own origins and squares off in an epic battle with his deadliest foe.	Rupert Friend,Hannah Ware,Zachary Quinto	Action,Adventure,Crime,Sci-Fi,Thriller	USA,UK,Germany	5.7	80823	8326530
tt4094724	The Purge: Election Year	2016	James DeMonaco	It's been two years since Leo Barnes (Frank Grillo) stopped himself from a regrettable act of revenge on Purge Night. Now serving as head of security for Senator Charlie Roan (Elizabeth Mitchell), his mission is to protect her in a run for president and survive the annual ritual that targets the poor and innocent. But when a betrayal forces them onto the streets of D.C. on the one night when no help is available, they must stay alive until dawn...or both be sacrificed for their sins against the state.	Frank Grillo,Elizabeth Mitchell,Mykelti Williamson	Action,Horror,Sci-Fi,Thriller	USA,Japan	6.0	80818	30870000
tt2567026	Alice Through the Looking Glass	2016	James Bobin	Alice returns to the magical world of Underland, only to find the Hatter in a horrible state. With the help of her friends, Alice must travel through time to save the Mad Hatter and Underland's fate from the evil clutches of the Red Queen and a clock like creature, known as Time.	Mia Wasikowska,Johnny Depp,Helena Bonham Carter	Adventure,Family,Fantasy	USA,UK	6.2	80570	28112000
tt4016934	The Handmaiden	2016	Chan-wook Park	1930s Korea, in the period of Japanese occupation, a new girl (Sookee) is hired as a handmaiden to a Japanese heiress (Hideko) who lives a secluded life on a large countryside estate with her domineering Uncle (Kouzuki). But the maid has a secret. She is a pickpocket recruited by a swindler posing as a Japanese Count to help him seduce the Lady to elope with him, rob her of her fortune, and lock her up in a madhouse. The plan seems to proceed according to plan until Sookee and Hideko discover some unexpected emotions.	Min-hee Kim,Jung-woo Ha,Jin-Woong Cho	Drama,Romance,Thriller	South Korea	8.1	80569	92129
tt4682786	Collateral Beauty	2016	David Frankel	When a successful New York advertising executive suffers a great tragedy, he retreats from life. While his concerned friends try desperately to reconnect with him, he seeks answers from the universe by writing letters to Love, Time and Death. But it's not until his notes bring unexpected personal responses that he begins to understand how these constants interlock in a life fully lived, and how even the deepest loss can reveal moments of meaning and beauty	Will Smith,Edward Norton,Kate Winslet	Drama,Romance	USA	6.8	79373	7102085
tt1981128	Geostorm	2017	Dean Devlin	When catastrophic climate change endangers Earth's very survival, world governments unite and create the Dutch Boy Program: a world wide net of satellites, surrounding the planet, that are armed with geoengineering technologies designed to stave off the natural disasters. After successfully protecting the planet for three years, something is starting to go wrong. Two estranged brothers are tasked with solving the program's malfunction before a world wide Geostorm can engulf the planet.	Gerard Butler,Jim Sturgess,Abbie Cornish	Action,Sci-Fi,Thriller	USA	5.3	79221	13707376
tt3072482	Hardcore Henry	2015	Ilya Naishuller	Waking inside a laboratory on an airship, a man recalls bullies from his childhood. A scientist, Estelle, greets him and tells him his name is Henry, she is his wife, and that he has been revived from an accident that left him amnesiac and mute. After she replaces a missing arm and leg with cybernetic prostheses, mercenaries led by the psychokinetic Akan raid the ship, claiming all of Estelle's research is Akan's corporate property. He kills Estelle's scientists before attempting to murder Henry, but Henry and Estelle flee in an escape pod, landing in Moscow. Estelle is abducted by the mercenaries, who try to kill Henry..	Sharlto Copley,Tim Roth,Haley Bennett	Action,Adventure,Sci-Fi,Thriller	Russia,USA,China	6.7	78751	5107604
tt1172049	Demolition	2015	Jean-Marc Vallée	Davis (Jake Gyllenhaal), a successful private equity fund partner, struggles after losing his wife in a tragic car crash. Despite pressure from his father-in-law, Phil (Chris Cooper), to pull it together, Davis continues to unravel. What starts as a complaint letter to a vending machine company turns into a series of letters revealing startling personal admissions. Davis' letters catch the attention of customer service rep, Karen (Naomi Watts), and, amidst emotional and financial burdens of her own, the two form an unlikely connection. With the help of Karen and her son Chris (Judah Lewis), Davis starts to rebuild, beginning with the demolition of the life he once knew.	Jake Gyllenhaal,Naomi Watts,Chris Cooper	Comedy,Drama	USA	7.0	78736	1098290
tt6266538	Vice	2018	Adam McKay	Governor George W. Bush of Texas picks Dick Cheney, the CEO of Halliburton Co, to be his Republican running mate in the 2000 presidential election. No stranger to politics, Cheney's impressive resume includes stints as White House chief of staff, House Minority Whip and defense secretary. When Bush wins by a narrow margin, Cheney begins to use his newfound power to help reshape the country and the world.	Christian Bale,Amy Adams,Steve Carell	Biography,Comedy,Drama	USA	7.2	78544	7768371
tt1293847	xXx: Reactivated	2017	D.J. Caruso	Extreme athlete turned government operative Xander Cage (Vin Diesel) comes out of self-imposed exile, thought to be long dead, and is set on a collision course with deadly alpha warrior Xiang (Donnie Yen) and his team in a race to recover a sinister and seemingly unstoppable weapon known as Pandora's Box. Recruiting an all-new group of thrill-seeking cohorts, Xander finds himself enmeshed in a deadly conspiracy that points to collusion at the highest levels of world governments.	Vin Diesel,Donnie Yen,Deepika Padukone	Action,Adventure,Thriller	China,Canada,USA	5.2	78497	20130
tt3322364	Concussion	2015	Peter Landesman	Will Smith stars in Concussion, a dramatic thriller based on the incredible true David vs. Goliath story of American immigrant Dr. Bennet Omalu, the brilliant forensic neuropathologist who made the first discovery of CTE, a football-related brain trauma, in a pro player and fought for the truth to be known. Omalu's emotional quest puts him at dangerous odds with one of the most powerful institutions in the world.	Will Smith,Alec Baldwin,Albert Brooks	Biography,Drama,Sport	UK,Australia,USA	7.1	78002	10513749
